{
 "$schema": "https://json-schema.org/draft/2020-12/schema",
 "title": "review_queue",
 "x-schema-version": "1.0",
 "type": "array",
 "items": {
  "type": "object",
  "properties": {
   "evidence": {
    "type": "array",
    "items": {
     "type": "string"
    }
   },
   "field": {
    "type": "string"
   },
   "id": {
    "type": "string"
   },
   "kind": {
    "type": "string"
   },
   "message": {
    "type": "string"
   },
   "severity": {
    "type": "string"
   },
   "status": {
    "type": "string"
   },
   "subject": {
    "type": "string"
   }
  },
  "required": [
   "evidence",
   "field",
   "id",
   "kind",
   "message",
   "severity",
   "status",
   "subject"
  ]
 }
}