[
 {
  "evidence": [],
  "field": "text",
  "id": "rv_90074db0f938",
  "kind": "unparsed",
  "message": "Handout has no extractable text layer (scanned image); OCR required",
  "severity": "error",
  "status": "open",
  "subject": "handout:handouts/348_MAC_F214.pdf"
 },
 {
  "evidence": [],
  "field": "course_codes",
  "id": "rv_ac7f55d501de",
  "kind": "ambiguous_mapping",
  "message": "File name code BIO U101 not among handout course numbers ['BIO F101']",
  "severity": "info",
  "status": "open",
  "subject": "handout:handouts/025_BIO_U101.pdf"
 },
 {
  "evidence": [],
  "field": "course_codes",
  "id": "rv_9ec796c95978",
  "kind": "ambiguous_mapping",
  "message": "File name code BITS F101 not among handout course numbers ['SW E101']",
  "severity": "info",
  "status": "open",
  "subject": "handout:handouts/032_BITS_F101-1.pdf"
 },
 {
  "evidence": [],
  "field": "course_codes",
  "id": "rv_4781153768b3",
  "kind": "ambiguous_mapping",
  "message": "File name code CS F111 not among handout course numbers ['CS U111']",
  "severity": "info",
  "status": "open",
  "subject": "handout:handouts/160_CS_F111.pdf"
 },
 {
  "evidence": [],
  "field": "course_codes",
  "id": "rv_dcef57fa7bd9",
  "kind": "ambiguous_mapping",
  "message": "File name code CS F215 not among handout course numbers ['EEE F342', 'ECE F342', 'INSTR F342', 'CS F342']",
  "severity": "info",
  "status": "open",
  "subject": "handout:handouts/162_CS_F215.pdf"
 },
 {
  "evidence": [],
  "field": "course_codes",
  "id": "rv_da7bb911b849",
  "kind": "ambiguous_mapping",
  "message": "File name code MAC F367 not among handout course numbers ['MATH F367']",
  "severity": "info",
  "status": "open",
  "subject": "handout:handouts/354_MAC_F367.pdf"
 },
 {
  "evidence": [],
  "field": "course_codes",
  "id": "rv_3fb8eca4100e",
  "kind": "ambiguous_mapping",
  "message": "File name code MPBA G520 not among handout course numbers ['MPBA G521', 'BITS F455']",
  "severity": "info",
  "status": "open",
  "subject": "handout:handouts/452_MPBA_G520.pdf"
 },
 {
  "evidence": [
   "ev_6c380e5bdf49"
  ],
  "field": "core",
  "id": "rv_51f953f0d0d4",
  "kind": "conflict",
  "message": "Core-list courses absent from the semester chart: BIOT F344",
  "severity": "info",
  "status": "open",
  "subject": "curriculum:BE-BIOTECHNOLOGY"
 },
 {
  "evidence": [
   "ev_9caef98a82ea"
  ],
  "field": "core",
  "id": "rv_bced63c489b3",
  "kind": "conflict",
  "message": "Core-list courses absent from the semester chart: ECE F331",
  "severity": "info",
  "status": "open",
  "subject": "curriculum:BE-ELECTRONICS-COMMUNICATION"
 },
 {
  "evidence": [
   "ev_66cee3699b15"
  ],
  "field": "core",
  "id": "rv_b1a71228d325",
  "kind": "conflict",
  "message": "Core-list courses absent from the semester chart: ENVS F232",
  "severity": "info",
  "status": "open",
  "subject": "curriculum:BE-ENVIRONMENTAL-AND-SUSTAINABILITY-ENGINEERING"
 },
 {
  "evidence": [
   "ev_aa2e4643c371"
  ],
  "field": "core",
  "id": "rv_aba8db88f0f1",
  "kind": "conflict",
  "message": "Core-list courses absent from the semester chart: PHA F243",
  "severity": "info",
  "status": "open",
  "subject": "curriculum:BPHARM"
 },
 {
  "evidence": [
   "ev_1ac418d43425"
  ],
  "field": "bulletin_description",
  "id": "rv_c6a45803f4a9",
  "kind": "missing",
  "message": "Offered in timetable but not described in bulletin Part VI",
  "severity": "info",
  "status": "open",
  "subject": "course:BIO U101"
 },
 {
  "evidence": [
   "ev_143c41b127ab"
  ],
  "field": "bulletin_description",
  "id": "rv_6491880588ff",
  "kind": "missing",
  "message": "Offered in timetable but not described in bulletin Part VI",
  "severity": "info",
  "status": "open",
  "subject": "course:BIO U320"
 },
 {
  "evidence": [
   "ev_e245b1bf696c"
  ],
  "field": "bulletin_description",
  "id": "rv_5fceb7e991e8",
  "kind": "missing",
  "message": "Offered in timetable but not described in bulletin Part VI",
  "severity": "info",
  "status": "open",
  "subject": "course:BIO U417"
 },
 {
  "evidence": [
   "ev_0cba76bfbf54"
  ],
  "field": "bulletin_description",
  "id": "rv_5bfec166d40b",
  "kind": "missing",
  "message": "Offered in timetable but not described in bulletin Part VI",
  "severity": "info",
  "status": "open",
  "subject": "course:BIOT U317"
 },
 {
  "evidence": [
   "ev_ba3d0ab1d774"
  ],
  "field": "bulletin_description",
  "id": "rv_3eace089d945",
  "kind": "missing",
  "message": "Offered in timetable but not described in bulletin Part VI",
  "severity": "info",
  "status": "open",
  "subject": "course:BITS C790T"
 },
 {
  "evidence": [
   "ev_b50fb345004b"
  ],
  "field": "bulletin_description",
  "id": "rv_ae8d2eca0044",
  "kind": "missing",
  "message": "Offered in timetable but not described in bulletin Part VI",
  "severity": "info",
  "status": "open",
  "subject": "course:BITS C791T"
 },
 {
  "evidence": [
   "ev_0e57c1f1ab5e"
  ],
  "field": "bulletin_description",
  "id": "rv_84db48756050",
  "kind": "missing",
  "message": "Offered in timetable but not described in bulletin Part VI",
  "severity": "info",
  "status": "open",
  "subject": "course:BITS C797T"
 },
 {
  "evidence": [
   "ev_6dd7c5cb691c"
  ],
  "field": "bulletin_description",
  "id": "rv_e2afe1465077",
  "kind": "missing",
  "message": "Offered in timetable but not described in bulletin Part VI",
  "severity": "info",
  "status": "open",
  "subject": "course:BITS C799T"
 },
 {
  "evidence": [
   "ev_87835814e857"
  ],
  "field": "bulletin_description",
  "id": "rv_5d2803a43d9b",
  "kind": "missing",
  "message": "Offered in timetable but not described in bulletin Part VI",
  "severity": "info",
  "status": "open",
  "subject": "course:BITS E574"
 },
 {
  "evidence": [
   "ev_e6922efa500b"
  ],
  "field": "bulletin_description",
  "id": "rv_ee47c5a29b5d",
  "kind": "missing",
  "message": "Offered in timetable but not described in bulletin Part VI",
  "severity": "info",
  "status": "open",
  "subject": "course:BITS E584"
 },
 {
  "evidence": [
   "ev_fe45fafa5dbb"
  ],
  "field": "bulletin_description",
  "id": "rv_298b9fa46a90",
  "kind": "missing",
  "message": "Offered in timetable but not described in bulletin Part VI",
  "severity": "info",
  "status": "open",
  "subject": "course:BITS E594"
 },
 {
  "evidence": [
   "ev_c479313752df"
  ],
  "field": "bulletin_description",
  "id": "rv_b97474ee2c28",
  "kind": "missing",
  "message": "Offered in timetable but not described in bulletin Part VI",
  "severity": "info",
  "status": "open",
  "subject": "course:BITS E793T"
 },
 {
  "evidence": [
   "ev_d3cdb02cc91f"
  ],
  "field": "bulletin_description",
  "id": "rv_5f58fe8bee21",
  "kind": "missing",
  "message": "Offered in timetable but not described in bulletin Part VI",
  "severity": "info",
  "status": "open",
  "subject": "course:BITS F103"
 },
 {
  "evidence": [
   "ev_2b89b3e296a8"
  ],
  "field": "bulletin_description",
  "id": "rv_560257aee173",
  "kind": "missing",
  "message": "Offered in timetable but not described in bulletin Part VI",
  "severity": "info",
  "status": "open",
  "subject": "course:BITS F110"
 },
 {
  "evidence": [
   "ev_ee6a13c6aa86"
  ],
  "field": "bulletin_description",
  "id": "rv_a03711864d66",
  "kind": "missing",
  "message": "Offered in timetable but not described in bulletin Part VI",
  "severity": "info",
  "status": "open",
  "subject": "course:BITS F332"
 },
 {
  "evidence": [
   "ev_4ac459415b98"
  ],
  "field": "bulletin_description",
  "id": "rv_9bcff92f3159",
  "kind": "missing",
  "message": "Offered in timetable but not described in bulletin Part VI",
  "severity": "info",
  "status": "open",
  "subject": "course:BITS F426T"
 },
 {
  "evidence": [
   "ev_fe1d3331f9ae"
  ],
  "field": "bulletin_description",
  "id": "rv_53651fcf8c3f",
  "kind": "missing",
  "message": "Offered in timetable but not described in bulletin Part VI",
  "severity": "info",
  "status": "open",
  "subject": "course:BITS G561T"
 },
 {
  "evidence": [
   "ev_8b7288b15c35"
  ],
  "field": "bulletin_description",
  "id": "rv_19c0306ed929",
  "kind": "missing",
  "message": "Offered in timetable but not described in bulletin Part VI",
  "severity": "info",
  "status": "open",
  "subject": "course:BITS G562T"
 },
 {
  "evidence": [
   "ev_a75ac4429818"
  ],
  "field": "bulletin_description",
  "id": "rv_048ff230088f",
  "kind": "missing",
  "message": "Offered in timetable but not described in bulletin Part VI",
  "severity": "info",
  "status": "open",
  "subject": "course:BITS G563T"
 },
 {
  "evidence": [
   "ev_e4ecfdc17b1f"
  ],
  "field": "bulletin_description",
  "id": "rv_994718e7bb79",
  "kind": "missing",
  "message": "Offered in timetable but not described in bulletin Part VI",
  "severity": "info",
  "status": "open",
  "subject": "course:BITS G564T"
 },
 {
  "evidence": [
   "ev_2cb0943aaae8"
  ],
  "field": "bulletin_description",
  "id": "rv_071ba60437ca",
  "kind": "missing",
  "message": "Offered in timetable but not described in bulletin Part VI",
  "severity": "info",
  "status": "open",
  "subject": "course:BITS G629T"
 },
 {
  "evidence": [
   "ev_17dbf0eced7e"
  ],
  "field": "bulletin_description",
  "id": "rv_e9c957c67936",
  "kind": "missing",
  "message": "Offered in timetable but not described in bulletin Part VI",
  "severity": "info",
  "status": "open",
  "subject": "course:BITS G661"
 },
 {
  "evidence": [
   "ev_e7e0daabf9e0"
  ],
  "field": "bulletin_description",
  "id": "rv_f70b381b9fae",
  "kind": "missing",
  "message": "Offered in timetable but not described in bulletin Part VI",
  "severity": "info",
  "status": "open",
  "subject": "course:BITS K101"
 },
 {
  "evidence": [
   "ev_00c2e8e8191a"
  ],
  "field": "bulletin_description",
  "id": "rv_e87e03919c3f",
  "kind": "missing",
  "message": "Offered in timetable but not described in bulletin Part VI",
  "severity": "info",
  "status": "open",
  "subject": "course:BITS U103"
 },
 {
  "evidence": [
   "ev_72e9ad1640d8"
  ],